{
  "schema_version": "1.0",
  "dataset_id": "synthetic-dental-demo-2026-2027-v1",
  "synthetic_demo": true,
  "currency": "USD",
  "money_unit": "integer_cents",
  "rate_unit": "basis_points",
  "source": {
    "source_id": "synthetic-demo-benefit-schedule-2026-v1",
    "file_name": "sources/SYNTHETIC_DEMO_BENEFIT_SCHEDULE.md",
    "document_role": "synthetic_schedule_of_benefits",
    "verification_status": "VERIFIED_DEMO",
    "warning": "Authorized for synthetic hackathon calculations only; not an actual carrier plan."
  },
  "shared_rules": {
    "plan_year": {
      "basis": "calendar_year",
      "reset_month": 1,
      "reset_day": 1,
      "evidence_ref": "synthetic-demo-benefit-schedule-2026-v1#plan-identity-and-applicability"
    },
    "waiting_periods": {
      "on_time_enrollee_months": {
        "preventive": 0,
        "basic": 0,
        "major": 0,
        "orthodontic": 0
      },
      "late_enrollee_months": {
        "preventive": 0,
        "basic": 6,
        "major": 12,
        "orthodontic": 12
      },
      "evidence_ref": "synthetic-demo-benefit-schedule-2026-v1#waiting-periods"
    },
    "frequency_limits": [
      {
        "rule_id": "frequency-D0120",
        "cdt": "D0120",
        "count": 2,
        "period_type": "calendar_year",
        "evidence_ref": "synthetic-demo-benefit-schedule-2026-v1#frequency-and-age-limits"
      },
      {
        "rule_id": "frequency-D1110",
        "cdt": "D1110",
        "count": 2,
        "period_type": "calendar_year",
        "evidence_ref": "synthetic-demo-benefit-schedule-2026-v1#frequency-and-age-limits"
      },
      {
        "rule_id": "frequency-D0274",
        "cdt": "D0274",
        "count": 1,
        "period_type": "calendar_year",
        "evidence_ref": "synthetic-demo-benefit-schedule-2026-v1#frequency-and-age-limits"
      },
      {
        "rule_id": "frequency-D0210",
        "cdt": "D0210",
        "count": 1,
        "period_type": "rolling_months",
        "period_months": 60,
        "evidence_ref": "synthetic-demo-benefit-schedule-2026-v1#frequency-and-age-limits"
      },
      {
        "rule_id": "replacement-D2740",
        "cdt": "D2740",
        "count": 1,
        "period_type": "rolling_months_per_tooth",
        "period_months": 60,
        "evidence_ref": "synthetic-demo-benefit-schedule-2026-v1#frequency-and-age-limits"
      },
      {
        "rule_id": "frequency-D1206",
        "cdt": "D1206",
        "count": 2,
        "period_type": "calendar_year",
        "maximum_age_inclusive": 18,
        "evidence_ref": "synthetic-demo-benefit-schedule-2026-v1#frequency-and-age-limits"
      },
      {
        "rule_id": "frequency-D1351",
        "cdt": "D1351",
        "count": 1,
        "period_type": "rolling_months_per_tooth",
        "period_months": 36,
        "maximum_age_inclusive": 15,
        "evidence_ref": "synthetic-demo-benefit-schedule-2026-v1#frequency-and-age-limits"
      }
    ],
    "procedure_catalog": [
      {"cdt": "D0120", "label": "Periodic exam", "default_class": "preventive"},
      {"cdt": "D1110", "label": "Adult cleaning", "default_class": "preventive"},
      {"cdt": "D0274", "label": "Bitewings", "default_class": "preventive"},
      {"cdt": "D2392", "label": "Two-surface posterior composite filling", "default_class": "basic"},
      {"cdt": "D3330", "label": "Molar root canal", "default_class": "basic"},
      {"cdt": "D7140", "label": "Simple extraction", "default_class": "basic"},
      {"cdt": "D4341", "label": "Scaling and root planing, per quadrant", "default_class": "basic"},
      {"cdt": "D2740", "label": "Ceramic crown", "default_class": "major"},
      {"cdt": "D2950", "label": "Core buildup", "default_class": "major"},
      {"cdt": "D6010", "label": "Implant placement", "default_class": "major"},
      {"cdt": "D8080", "label": "Comprehensive orthodontics", "default_class": "orthodontic"}
    ]
  },
  "plans": [
    {
      "plan_id": "demo-value-dppo",
      "plan_version_id": "demo-value-dppo-2026-2027-v1",
      "display_name": "Demo Dental Value DPPO",
      "carrier": "Synthetic Demo Carrier",
      "employer_group_id": "HACKATHON-DEMO",
      "jurisdiction": "VA",
      "plan_type": "DPPO",
      "option_tier": "value",
      "effective_from": "2026-01-01",
      "effective_to": "2027-12-31",
      "verification_status": "VERIFIED_DEMO",
      "monthly_employee_contribution_cents": {
        "employee_only": 1200,
        "employee_spouse": 2600,
        "employee_children": 3000,
        "family": 4600
      },
      "deductible": {
        "rule_ids": {"in_network": "value-in-network-deductible-7500", "out_of_network": "value-out-of-network-deductible-10000"},
        "in_network": {"individual_cents": 7500, "family_cents": 22500},
        "out_of_network": {"individual_cents": 10000, "family_cents": 30000},
        "network_accumulation": "separate",
        "waived_for_service_classes": ["preventive"],
        "family_basis": "embedded",
        "evidence_ref": "synthetic-demo-benefit-schedule-2026-v1#deductibles-and-maximums"
      },
      "annual_maximum": {
        "rule_id": "value-annual-maximum-100000",
        "individual_cents": 100000,
        "network_accumulation": "combined",
        "accumulator_basis": "plan_paid_amount",
        "preventive_counts_toward_maximum": true,
        "evidence_ref": "synthetic-demo-benefit-schedule-2026-v1#deductibles-and-maximums"
      },
      "coverage": {
        "preventive": {"in_network_rule_id": "value-preventive-in-network-10000bps", "out_of_network_rule_id": "value-preventive-out-of-network-8000bps", "in_network_plan_share_bps": 10000, "out_of_network_plan_share_bps": 8000, "deductible_applies": false},
        "basic": {"in_network_rule_id": "value-basic-in-network-7000bps", "out_of_network_rule_id": "value-basic-out-of-network-5000bps", "in_network_plan_share_bps": 7000, "out_of_network_plan_share_bps": 5000, "deductible_applies": true},
        "major": {"in_network_rule_id": "value-major-in-network-4000bps", "out_of_network_rule_id": "value-major-out-of-network-3000bps", "in_network_plan_share_bps": 4000, "out_of_network_plan_share_bps": 3000, "deductible_applies": true},
        "orthodontic": {"in_network_rule_id": "value-orthodontic-excluded", "out_of_network_rule_id": "value-orthodontic-excluded", "covered": false, "in_network_plan_share_bps": 0, "out_of_network_plan_share_bps": 0, "deductible_applies": false},
        "evidence_ref": "synthetic-demo-benefit-schedule-2026-v1#plan-share-by-service-class"
      },
      "orthodontic_lifetime_maximum_cents": 0,
      "procedure_class_overrides": [
        {"cdt": "D6010", "service_class": "excluded", "rule_id": "value-excludes-D6010"},
        {"cdt": "D8080", "service_class": "excluded", "rule_id": "value-excludes-D8080"}
      ],
      "rollover": {
        "enabled": false,
        "threshold_plan_paid_cents": null,
        "base_award_cents": 0,
        "network_bonus_cents": 0,
        "bank_cap_cents": 0,
        "evidence_ref": "synthetic-demo-benefit-schedule-2026-v1#synthetic-rollover-rules"
      }
    },
    {
      "plan_id": "demo-core-dppo",
      "plan_version_id": "demo-core-dppo-2026-2027-v1",
      "display_name": "Demo Dental Core DPPO",
      "carrier": "Synthetic Demo Carrier",
      "employer_group_id": "HACKATHON-DEMO",
      "jurisdiction": "VA",
      "plan_type": "DPPO",
      "option_tier": "core",
      "effective_from": "2026-01-01",
      "effective_to": "2027-12-31",
      "verification_status": "VERIFIED_DEMO",
      "monthly_employee_contribution_cents": {
        "employee_only": 2600,
        "employee_spouse": 5400,
        "employee_children": 6500,
        "family": 9800
      },
      "deductible": {
        "rule_ids": {"in_network": "core-in-network-deductible-5000", "out_of_network": "core-out-of-network-deductible-7500"},
        "in_network": {"individual_cents": 5000, "family_cents": 15000},
        "out_of_network": {"individual_cents": 7500, "family_cents": 22500},
        "network_accumulation": "separate",
        "waived_for_service_classes": ["preventive"],
        "family_basis": "embedded",
        "evidence_ref": "synthetic-demo-benefit-schedule-2026-v1#deductibles-and-maximums"
      },
      "annual_maximum": {
        "rule_id": "core-annual-maximum-150000",
        "individual_cents": 150000,
        "network_accumulation": "combined",
        "accumulator_basis": "plan_paid_amount",
        "preventive_counts_toward_maximum": true,
        "evidence_ref": "synthetic-demo-benefit-schedule-2026-v1#deductibles-and-maximums"
      },
      "coverage": {
        "preventive": {"in_network_rule_id": "core-preventive-in-network-10000bps", "out_of_network_rule_id": "core-preventive-out-of-network-8000bps", "in_network_plan_share_bps": 10000, "out_of_network_plan_share_bps": 8000, "deductible_applies": false},
        "basic": {"in_network_rule_id": "core-basic-in-network-8000bps", "out_of_network_rule_id": "core-basic-out-of-network-6000bps", "in_network_plan_share_bps": 8000, "out_of_network_plan_share_bps": 6000, "deductible_applies": true},
        "major": {"in_network_rule_id": "core-major-in-network-5000bps", "out_of_network_rule_id": "core-major-out-of-network-4000bps", "in_network_plan_share_bps": 5000, "out_of_network_plan_share_bps": 4000, "deductible_applies": true},
        "orthodontic": {"in_network_rule_id": "core-orthodontic-in-network-5000bps", "out_of_network_rule_id": "core-orthodontic-out-of-network-5000bps", "covered": true, "in_network_plan_share_bps": 5000, "out_of_network_plan_share_bps": 5000, "deductible_applies": false},
        "evidence_ref": "synthetic-demo-benefit-schedule-2026-v1#plan-share-by-service-class"
      },
      "orthodontic_lifetime_maximum_cents": 100000,
      "procedure_class_overrides": [],
      "rollover": {
        "enabled": true,
        "threshold_plan_paid_cents": 60000,
        "base_award_cents": 25000,